{
  "id": "e0b8a4f2-51a2-4011-87bc-22910daff212",
  "machine_id": "8c4b18c0-51a2-4db0-96ef-2782bcfb2111",
  "sensor_id": "d09a8f4c-11b2-4911-88bc-41829daff901",
  "severity": "CRITICAL",
  "state": "ACTIVE",
  "trigger_timestamp": "2026-07-03T13:53:11.005Z",
  "trigger_value": 112.5,
  "threshold_violated": "upper_threshold_limit"
}
